{
  "$schema": "https://voyager.nagi.fun/site.schema.json",
  "id": "claude",
  "label": "Claude",
  "matches": ["https://claude.ai/*", "https://*.frame.claudeusercontent.com/*"],
  "selectors": {
    "userTurn": "[data-testid=\"user-message\"]",
    "assistantTurn": ".font-claude-message, [data-testid=\"assistant-message\"]",
    "composer": "div[contenteditable=\"true\"].ProseMirror",
    "sidebar": "nav[aria-label], [data-testid=\"menu-sidebar\"]"
  },
  "theme": {
    "hostSelector": ":root",
    "lightSelector": ":root:not(.dark)",
    "darkSelector": ":root.dark"
  },
  "brandColor": "#d97757",
  "capabilities": ["chat", "sidebar", "composer", "darkMode"],
  "conversationIdPattern": "^/chat/([^/?#]+)"
}
