{
  "$schema": "https://voyager.nagi.fun/site.schema.json",
  "id": "chatgpt",
  "label": "ChatGPT",
  "matches": ["https://chatgpt.com/*", "https://chat.openai.com/*"],
  "selectors": {
    "userTurn": "[data-message-author-role=\"user\"]",
    "assistantTurn": "[data-message-author-role=\"assistant\"], [class*=\"group/imagegen-image\"]",
    "composer": "#prompt-textarea, div[contenteditable=\"true\"]",
    "sidebar": "nav[aria-label], #stage-slideover-sidebar"
  },
  "theme": {
    "hostSelector": "html",
    "lightSelector": "html.light",
    "darkSelector": "html.dark"
  },
  "brandColor": "#0ea5e9",
  "capabilities": ["chat", "sidebar", "composer", "darkMode"],
  "conversationIdPattern": "^/c/([^/?#]+)"
}
